{
  "schemaVersion": "1.0",
  "chainId": "31337",
  "hook": "0xb2b2b2b2b2b2b2b2b2b2b2b2b2b2b2b2b2b2b2b2",
  "registry": "0xb1b1b1b1b1b1b1b1b1b1b1b1b1b1b1b1b1b1b1b1",
  "baseBuyFeeBps": 500,
  "baseSellFeeBps": 700,
  "modules": [
    {
      "versionId": "0xb3600c35c76782be158f8d2c4367bb64f86c181c501450c98e1301a27f1cf988",
      "config": "0x0000000000000000000000000000000000000000000000000de0b6b3a76400000000000000000000000000000000000000000000000000001bc16d674ec80000",
      "parameters": {
        "buyLimit": "1000000000000000000",
        "sellLimit": "2000000000000000000"
      }
    },
    {
      "versionId": "0xc6413dc6744db79b200698b78ccec4178a8d98b969e231788547c9f093727314",
      "config": "0x000000000000000000000000000000000000000000000000000000000000000000000000000000000000000000000000000000000000000000000000000000640000000000000000000000000000000000000000000000000000000000000e10",
      "parameters": {
        "buyEnd": 0,
        "sellEnd": 100,
        "duration": 3600
      }
    }
  ]
}
